{"version":1,"story":"gh-118","slice":"gh-118/06","unit_dir":"06-workflows-ci-docs","workflow":"slice","workflow_hash":"c307ec7f68996151aad79d295de3fbf3efd34ffda45e1b1afe155985a6f1e9f9","step":"implement","attempt":2,"visits":{"implement":2},"step_entered_at":"2026-10-31T21:04:36.389Z","status":"running","park":null,"counters":{"test_loop":0,"review_loop":0,"qa_loop":0,"conflict_loop":0},"nudges_used":0,"retries_used":0,"applied_through":6,"run":{"run_id":"01M69WFJAMV12ZSQFZVK8WWJSG","step":"implement","attempt":2,"started_at":"2026-10-31T21:05:13.601Z","how":"auto","agent":"claude","session":{"runner":"herdr","session_id":"wDD:p1","pane_id":"wDD:p1","reach":"herdr agent attach wDD:p1"},"process":{"pid":72833,"pid_start":"Sat Oct 31 22:05:13 2026"},"machine":"jakubpruszynski@mac","heartbeat_id":"01M5TCF2ZJVH8KS2NPJH9PP5SD"},"last_outcome":{"step":"implement","outcome":"stuck","source":"human","at":"2026-10-31T20:20:30.935Z","receipt_id":"01M69SXXJQ9TA39AFQEJYHZ8G3"},"created_at":"2026-10-31T20:19:36.194Z","updated_at":"2026-10-31T21:05:13.602Z","last_tick_id":"01M69WFJAMMA83D4C36SFYHMD2"}
