{"version":1,"story":"gh-71","slice":"gh-71/04","unit_dir":"04-round-folders-and-migrate","workflow":"slice","workflow_hash":"534d8cf2c5e09d1113a08fb6fa63b30430b5068c14229e12224d3f5dd47ee74f","step":"test","attempt":2,"visits":{"implement":2,"test":2,"review":1},"step_entered_at":"2026-11-01T11:50:34.357Z","status":"ready","park":null,"counters":{"test_loop":0,"review_loop":1,"qa_loop":0,"conflict_loop":0},"nudges_used":0,"retries_used":0,"applied_through":10,"run":null,"last_outcome":{"step":"implement","outcome":"done","source":"reported","at":"2026-11-01T11:50:24.738Z","receipt_id":"01M6BF4KQ2HTY6AKJFPWCMGA1C"},"created_at":"2026-11-01T11:07:04.087Z","updated_at":"2026-11-01T11:50:34.357Z","last_tick_id":"01M6BF4X3MZD1KKCHJGC054BDM"}
