{"version":1,"story":"gh-118","slice":"gh-118/04","unit_dir":"04-store-adapters-view-into-tiers","workflow":"slice","workflow_hash":"c307ec7f68996151aad79d295de3fbf3efd34ffda45e1b1afe155985a6f1e9f9","step":"implement","attempt":1,"visits":{"implement":1},"step_entered_at":"2026-10-31T20:19:36.194Z","status":"ready","park":null,"counters":{"test_loop":0,"review_loop":0,"qa_loop":0,"conflict_loop":0},"nudges_used":0,"retries_used":0,"applied_through":0,"run":null,"last_outcome":null,"created_at":"2026-10-31T20:19:36.194Z","updated_at":"2026-10-31T20:19:36.194Z","last_tick_id":"01M69SW83Z5W2TEVAJ6TMC80ZT"}
