{"version":1,"story":"gh-118","slice":null,"unit_dir":"_story","workflow":"story","workflow_hash":"3348b793a3dcf7b2d5de9c16017f75434dda0aab2e5deac1ba8ed57063bd4f2f","step":"implement","attempt":2,"visits":{"refine":1,"plan":1,"slice":1,"approve-plan":2,"update":3,"resolve":1,"test":2,"slices":4,"implement":2},"step_entered_at":"2026-10-31T22:34:36.868Z","status":"running","park":null,"counters":{"plan_loop":0,"test_loop":1,"ci_loop":0,"qa_loop":0,"ready_loop":0,"base_conflict_loop":0,"stale_loop":0},"nudges_used":0,"retries_used":0,"applied_through":41,"run":{"run_id":"01M6A1MC7M5FGYBMXR8GRV9XJ7","step":"implement","attempt":2,"started_at":"2026-10-31T22:35:10.626Z","how":"auto","agent":"claude","session":{"runner":"herdr","session_id":"wDS:p1","pane_id":"wDS:p1","reach":"herdr agent attach wDS:p1"},"process":{"pid":15223,"pid_start":"Sat Oct 31 23:35:10 2026"},"machine":"jakubpruszynski@mac","heartbeat_id":"01M5TCF2ZJVH8KS2NPJH9PP5SD"},"last_outcome":{"step":"implement","outcome":"stuck","source":"human","at":"2026-10-31T22:33:47.021Z","receipt_id":"01M6A1HY8DGHSTXWRTEAS3DQNG"},"created_at":"2026-10-30T15:04:08.088Z","updated_at":"2026-10-31T22:35:10.628Z","last_tick_id":"01M6A1MC7M9DAVH3EB6999G1RD","mode":"auto"}
