{"version":1,"story":"gh-118","slice":"gh-118/02","unit_dir":"02-unit-guard","workflow":"slice","workflow_hash":"c307ec7f68996151aad79d295de3fbf3efd34ffda45e1b1afe155985a6f1e9f9","step":"qa","attempt":1,"visits":{"implement":2,"test":1,"review":1,"qa":1},"step_entered_at":"2026-10-31T17:56:08.463Z","status":"running","park":null,"counters":{"test_loop":0,"review_loop":0,"qa_loop":0,"conflict_loop":0},"nudges_used":0,"retries_used":0,"applied_through":13,"run":{"run_id":"01M69HPFE02SW90BMBTVD3ZE22","step":"qa","attempt":1,"started_at":"2026-10-31T17:56:46.144Z","how":"auto","agent":"claude","session":{"runner":"herdr","session_id":"wCQ:p1","pane_id":"wCQ:p1","reach":"herdr agent attach wCQ:p1"},"process":{"pid":60618,"pid_start":"Sat Oct 31 18:56:46 2026"},"machine":"jakubpruszynski@mac","heartbeat_id":"01M5TCF2ZJVH8KS2NPJH9PP5SD"},"last_outcome":{"step":"review","outcome":"approve","source":"reported","at":"2026-10-31T17:55:43.528Z","receipt_id":"01M69HMSS8RM6NYRK6TP4PA2K9"},"created_at":"2026-10-31T16:51:27.413Z","updated_at":"2026-10-31T17:56:46.146Z","last_tick_id":"01M69HPFE0HCTGSFFWFWS9Z06F"}
