{"version":1,"story":"gh-71","slice":"gh-71/10","unit_dir":"10-round-in-views","workflow":"slice","workflow_hash":"534d8cf2c5e09d1113a08fb6fa63b30430b5068c14229e12224d3f5dd47ee74f","step":"implement","attempt":1,"visits":{"implement":1},"step_entered_at":"2026-11-01T16:13:05.531Z","status":"ready","park":null,"counters":{"test_loop":0,"review_loop":0,"qa_loop":0,"conflict_loop":0},"nudges_used":0,"retries_used":0,"applied_through":0,"run":null,"last_outcome":null,"created_at":"2026-11-01T16:13:05.531Z","updated_at":"2026-11-01T16:13:05.531Z","last_tick_id":"01M6BY5K3RV6MCPHY0GT3XZQHW"}
