{
  "version": 1,
  "story": "gh-75",
  "slice": "gh-75/13",
  "unit_dir": "13-config-list-get-set-unset",
  "workflow": "slice",
  "workflow_hash": "c932ae645fb54a38db2d6d9f7d98533632fc9e7eef1aa3dd4d54861a1328fe09",
  "step": "review",
  "attempt": 1,
  "visits": {
    "implement": 1,
    "test": 1,
    "review": 1
  },
  "step_entered_at": "2026-10-28T19:07:25.475Z",
  "status": "running",
  "park": null,
  "counters": {
    "test_loop": 0,
    "review_loop": 0,
    "qa_loop": 0,
    "conflict_loop": 0
  },
  "nudges_used": 0,
  "retries_used": 0,
  "applied_through": 6,
  "run": {
    "run_id": "01M61Z33MYHVN5G3VJ2NMNG6NQ",
    "step": "review",
    "attempt": 1,
    "started_at": "2026-10-28T19:23:32.046Z",
    "how": "auto",
    "agent": "claude",
    "session": {
      "runner": "herdr",
      "session_id": "w86:p1",
      "pane_id": "w86:p1",
      "reach": "herdr agent attach w86:p1"
    },
    "process": {
      "pid": 24616,
      "pid_start": "Wed Oct 28 20:23:31 2026"
    },
    "machine": "jakubpruszynski@mac",
    "heartbeat_id": "01M5TCF2ZJVH8KS2NPJH9PP5SD"
  },
  "last_outcome": {
    "step": "test",
    "outcome": "pass",
    "source": "classified",
    "at": "2026-10-28T19:07:25.454Z",
    "receipt_id": "01M61YHXWEQRND53JXCCC505MG"
  },
  "created_at": "2026-10-28T14:13:16.910Z",
  "updated_at": "2026-10-28T19:23:32.048Z",
  "last_tick_id": "01M61Z33MYZF33XXMWS6SBH3AK"
}
