{"version":1,"story":"gh-107","slice":"gh-107/01","unit_dir":"01-day-file-reader","workflow":"slice","workflow_hash":"c307ec7f68996151aad79d295de3fbf3efd34ffda45e1b1afe155985a6f1e9f9","step":"qa","attempt":1,"visits":{"implement":1,"test":1,"review":1,"qa":1},"step_entered_at":"2026-10-30T15:39:40.578Z","status":"ready","park":null,"counters":{"test_loop":0,"review_loop":0,"qa_loop":0,"conflict_loop":0},"nudges_used":0,"retries_used":0,"applied_through":7,"run":null,"last_outcome":{"step":"review","outcome":"approve","source":"reported","at":"2026-10-30T15:39:24.182Z","receipt_id":"01M66QEF4PCBF8494WNPZ341P4"},"created_at":"2026-10-30T15:12:38.367Z","updated_at":"2026-10-30T15:39:40.578Z","last_tick_id":"01M66QEZ51JKX9D2AKKXWXRWYM"}
