{"version":1,"story":"gh-110","slice":"gh-110/07","unit_dir":"07-docs-skill-and-help","workflow":"slice","workflow_hash":"c307ec7f68996151aad79d295de3fbf3efd34ffda45e1b1afe155985a6f1e9f9","step":"review","attempt":1,"visits":{"implement":1,"test":1,"review":1},"step_entered_at":"2026-10-30T22:37:02.456Z","status":"ready","park":null,"counters":{"test_loop":0,"review_loop":0,"qa_loop":0,"conflict_loop":0},"nudges_used":0,"retries_used":0,"applied_through":4,"run":null,"last_outcome":{"step":"test","outcome":"pass","source":"classified","at":"2026-10-30T22:36:48.877Z","receipt_id":"01M67FARVCP498XMD04DNVJDBE"},"created_at":"2026-10-30T22:20:02.359Z","updated_at":"2026-10-30T22:37:02.456Z","last_tick_id":"01M67FB63P1AMVKZRWBXRVKGW1"}
