{"version":1,"story":"gh-107","slice":"gh-107/04","unit_dir":"04-per-unit-hook-files","workflow":"slice","workflow_hash":"c307ec7f68996151aad79d295de3fbf3efd34ffda45e1b1afe155985a6f1e9f9","step":"$done","attempt":2,"visits":{"implement":2,"test":2,"review":2,"qa":1,"integrate":2,"merge":1},"step_entered_at":"2026-10-30T18:55:34.004Z","status":"done","park":null,"counters":{"test_loop":0,"review_loop":1,"qa_loop":0,"conflict_loop":1},"nudges_used":0,"retries_used":0,"applied_through":22,"run":null,"last_outcome":{"step":"integrate","outcome":"done","source":"classified","at":"2026-10-30T18:56:14.549Z","receipt_id":"01M672PWPNZRVZHX82ZAEDY9YY"},"created_at":"2026-10-30T17:03:31.066Z","updated_at":"2026-10-30T18:56:34.028Z","last_tick_id":"01M672QFQCZS4E716SYZVP7K58"}
