{
  "version": 1,
  "story": "gh-75",
  "slice": "gh-75/09",
  "unit_dir": "09-run-rerun-and-cancel",
  "workflow": "slice",
  "workflow_hash": "c932ae645fb54a38db2d6d9f7d98533632fc9e7eef1aa3dd4d54861a1328fe09",
  "step": "review",
  "attempt": 2,
  "visits": {
    "implement": 2,
    "test": 2,
    "review": 2
  },
  "step_entered_at": "2026-10-28T17:40:23.365Z",
  "status": "ready",
  "park": null,
  "counters": {
    "test_loop": 0,
    "review_loop": 1,
    "qa_loop": 0,
    "conflict_loop": 0
  },
  "nudges_used": 0,
  "retries_used": 0,
  "applied_through": 11,
  "run": null,
  "last_outcome": {
    "step": "test",
    "outcome": "pass",
    "source": "classified",
    "at": "2026-10-28T17:40:23.342Z",
    "receipt_id": "01M61SJJ5DG5WXZYR554EYKBFR"
  },
  "created_at": "2026-10-28T14:13:16.910Z",
  "updated_at": "2026-10-28T17:40:23.365Z",
  "last_tick_id": "01M61SJJ64XRXQ6D8JERDBP2VS"
}
