{"version":1,"story":"gh-118","slice":"gh-118/07","unit_dir":"07-guard-on-and-measure","workflow":"slice","workflow_hash":"c307ec7f68996151aad79d295de3fbf3efd34ffda45e1b1afe155985a6f1e9f9","step":"integrate","attempt":1,"visits":{"implement":2,"test":1,"review":1,"qa":1,"human-qa":1,"integrate":1},"step_entered_at":"2026-10-31T22:29:36.867Z","status":"ready","park":null,"counters":{"test_loop":1,"review_loop":0,"qa_loop":0,"conflict_loop":0},"nudges_used":0,"retries_used":0,"applied_through":15,"run":null,"last_outcome":{"step":"human-qa","outcome":"approve","source":"human","at":"2026-10-31T22:29:32.884Z","receipt_id":"01M6A1A62M225HTASKR5V6QJ12"},"created_at":"2026-10-31T21:37:36.522Z","updated_at":"2026-10-31T22:29:36.867Z","last_tick_id":"01M6A1A9Z2ZWYKW20NFYXDW5Q4"}
