{"version":1,"story":"gh-71","slice":"gh-71/01","unit_dir":"01-record-folder-resolver","workflow":"slice","workflow_hash":"534d8cf2c5e09d1113a08fb6fa63b30430b5068c14229e12224d3f5dd47ee74f","step":"qa","attempt":1,"visits":{"implement":1,"test":1,"review":1,"qa":1},"step_entered_at":"2026-11-01T10:25:33.937Z","status":"running","park":null,"counters":{"test_loop":0,"review_loop":0,"qa_loop":0,"conflict_loop":0},"nudges_used":0,"retries_used":0,"applied_through":10,"run":{"run_id":"01M6BAA5H11KT9C2N4MKYWE2JH","step":"qa","attempt":1,"started_at":"2026-11-01T10:26:07.838Z","how":"auto","agent":"claude","session":{"runner":"herdr","session_id":"wE2:p1","pane_id":"wE2:p1","reach":"herdr agent attach wE2:p1"},"process":{"pid":29562,"pid_start":"Sun Nov 1 11:26:07 2026"},"machine":"jakubpruszynski@mac","heartbeat_id":"01M5TCF2ZJVH8KS2NPJH9PP5SD"},"last_outcome":{"step":"review","outcome":"approve","source":"reported","at":"2026-11-01T10:25:27.668Z","receipt_id":"01M6BA923MWGY1DKTNRVFC8WEH"},"created_at":"2026-11-01T10:00:20.853Z","updated_at":"2026-11-01T10:26:07.839Z","last_tick_id":"01M6BAA5H1FBK3PXSFTAZ6KB6F"}
